{
  "$schema": "https://json-schema.org/draft/2020-12/schema",
  "$id": "https://foker.dev/schemas/project-map/v1.json",
  "title": "Foker Project Map",
  "description": "Estado estructural derivado del proyecto gestionado. Caché reconstruible; ver FOKER-SPEC §8. Todas las colecciones van ordenadas por id para serialización canónica.",
  "type": "object",
  "additionalProperties": false,
  "required": [
    "schema_version",
    "foker_version",
    "generator",
    "generated_at",
    "content_hash",
    "config_hash",
    "project",
    "files",
    "symbols",
    "edges",
    "external_modules",
    "diagnostics",
    "stats"
  ],
  "properties": {
    "$schema": { "type": "string" },
    "schema_version": { "const": 1 },
    "foker_version": { "$ref": "../common/v1.json#/$defs/semver" },
    "generator": {
      "type": "object",
      "additionalProperties": false,
      "required": ["engine", "parsers", "resolver"],
      "properties": {
        "engine": { "description": "Versión de foker-map.", "$ref": "../common/v1.json#/$defs/semver" },
        "parsers": {
          "description": "Gramática tree-sitter → versión.",
          "type": "object",
          "additionalProperties": { "type": "string" }
        },
        "resolver": { "description": "Versión de oxc_resolver.", "type": "string" }
      }
    },
    "generated_at": {
      "description": "Informativo; excluido de content_hash.",
      "$ref": "../common/v1.json#/$defs/timestamp"
    },
    "content_hash": {
      "description": "BLAKE3 del JSON canónico sin generated_at, content_hash, stats.duration_ms ni files[].mtime_ns.",
      "$ref": "../common/v1.json#/$defs/hash"
    },
    "config_hash": {
      "description": "BLAKE3 de la sección map de la configuración efectiva.",
      "$ref": "../common/v1.json#/$defs/hash"
    },
    "project": {
      "type": "object",
      "additionalProperties": false,
      "required": ["name", "workspace_kind", "packages"],
      "properties": {
        "name": { "type": "string", "minLength": 1 },
        "workspace_kind": { "enum": ["pnpm", "npm", "yarn", "single"] },
        "packages": { "type": "array", "items": { "$ref": "#/$defs/package" } }
      }
    },
    "files": { "type": "array", "items": { "$ref": "#/$defs/file" } },
    "symbols": { "type": "array", "items": { "$ref": "#/$defs/symbol" } },
    "edges": { "type": "array", "items": { "$ref": "#/$defs/edge" } },
    "external_modules": {
      "description": "Paquetes npm importados, ordenados.",
      "type": "array",
      "items": { "$ref": "#/$defs/externalModuleId" }
    },
    "diagnostics": {
      "description": "Imports no resueltos, errores de parseo, archivos omitidos por tamaño. Ordenados por (file, code, subject).",
      "type": "array",
      "items": { "$ref": "../common/v1.json#/$defs/diagnostic" }
    },
    "stats": {
      "type": "object",
      "additionalProperties": false,
      "required": ["files", "symbols", "edges", "duration_ms"],
      "properties": {
        "files": { "type": "integer", "minimum": 0 },
        "symbols": { "type": "integer", "minimum": 0 },
        "edges": { "type": "integer", "minimum": 0 },
        "parse_errors": { "type": "integer", "minimum": 0 },
        "unresolved_imports": { "type": "integer", "minimum": 0 },
        "duration_ms": { "description": "Excluido de content_hash.", "type": "integer", "minimum": 0 }
      }
    }
  },
  "$defs": {
    "packageId": { "type": "string", "pattern": "^pkg:.+$" },
    "externalModuleId": { "type": "string", "pattern": "^npm:(@[a-z0-9-~][a-z0-9-._~]*/)?[a-z0-9-~][a-z0-9-._~]*$" },
    "symbolId": {
      "description": "<file_id>#<nombre_calificado>[~n]. Exportación por defecto anónima: #default.",
      "type": "string",
      "pattern": "^[^#]+#[^#]+$"
    },
    "package": {
      "type": "object",
      "additionalProperties": false,
      "required": ["id", "name", "path"],
      "properties": {
        "id": { "$ref": "#/$defs/packageId" },
        "name": { "type": "string", "minLength": 1 },
        "path": { "description": "Directorio del paquete; \".\" para el root.", "type": "string" },
        "version": { "type": ["string", "null"] }
      }
    },
    "file": {
      "type": "object",
      "additionalProperties": false,
      "required": [
        "id",
        "package",
        "language",
        "kind",
        "hash",
        "size_bytes",
        "lines",
        "mtime_ns",
        "parse_status",
        "rank",
        "exports"
      ],
      "properties": {
        "id": { "$ref": "../common/v1.json#/$defs/fileId" },
        "package": { "anyOf": [{ "$ref": "#/$defs/packageId" }, { "type": "null" }] },
        "language": { "enum": ["typescript", "tsx", "javascript", "jsx"] },
        "kind": { "enum": ["source", "test", "declaration", "config", "generated"] },
        "hash": { "$ref": "../common/v1.json#/$defs/hash" },
        "size_bytes": { "type": "integer", "minimum": 0 },
        "lines": { "type": "integer", "minimum": 0 },
        "mtime_ns": {
          "description": "Solo para detección de cambios; excluido de content_hash.",
          "type": "integer",
          "minimum": 0
        },
        "parse_status": { "enum": ["ok", "partial", "failed", "skipped"] },
        "rank": {
          "type": "object",
          "additionalProperties": false,
          "required": ["global"],
          "properties": {
            "global": {
              "description": "PageRank global normalizado (suma 1), redondeado a 1e-12.",
              "type": "number",
              "minimum": 0,
              "maximum": 1
            }
          }
        },
        "exports": { "type": "array", "items": { "$ref": "#/$defs/symbolId" } }
      }
    },
    "symbol": {
      "type": "object",
      "additionalProperties": false,
      "required": ["id", "name", "kind", "tags", "exported", "signature", "doc", "range", "parent"],
      "properties": {
        "id": { "$ref": "#/$defs/symbolId" },
        "name": { "type": "string", "minLength": 1 },
        "kind": {
          "enum": [
            "function",
            "class",
            "method",
            "property",
            "interface",
            "type_alias",
            "enum",
            "variable",
            "namespace"
          ]
        },
        "tags": {
          "description": "Heurísticas no normativas.",
          "type": "array",
          "items": { "enum": ["react_component", "react_hook", "next_route", "test_case", "async"] },
          "uniqueItems": true
        },
        "exported": { "enum": ["none", "named", "default", "reexport"] },
        "signature": {
          "description": "Firma sin cuerpo; máx. 400 caracteres más … si se trunca.",
          "type": "string",
          "maxLength": 401
        },
        "doc": {
          "description": "Primer párrafo de JSDoc; máx. 300 caracteres más ….",
          "type": ["string", "null"],
          "maxLength": 301
        },
        "range": { "$ref": "../common/v1.json#/$defs/range" },
        "parent": { "anyOf": [{ "$ref": "#/$defs/symbolId" }, { "type": "null" }] }
      }
    },
    "edge": {
      "description": "Arista tipada (FOKER-SPEC §8.2). Ordenadas por (kind, from, to).",
      "type": "object",
      "additionalProperties": false,
      "required": ["kind", "from", "to", "confidence"],
      "properties": {
        "kind": {
          "enum": [
            "imports",
            "imports_type",
            "reexports",
            "imports_external",
            "uses_symbol",
            "extends",
            "implements",
            "package_depends"
          ]
        },
        "from": { "type": "string", "minLength": 1 },
        "to": { "type": "string", "minLength": 1 },
        "confidence": { "enum": ["resolved", "heuristic", "declared"] },
        "weight": {
          "description": "uses_symbol: nº de referencias al binding en el archivo.",
          "type": "integer",
          "minimum": 1
        }
      },
      "allOf": [
        {
          "if": { "properties": { "kind": { "const": "uses_symbol" } } },
          "then": { "required": ["weight"], "properties": { "to": { "$ref": "#/$defs/symbolId" } } }
        },
        {
          "if": { "properties": { "kind": { "const": "imports_external" } } },
          "then": { "properties": { "to": { "$ref": "#/$defs/externalModuleId" } } }
        },
        {
          "if": { "properties": { "kind": { "const": "package_depends" } } },
          "then": {
            "properties": {
              "from": { "$ref": "#/$defs/packageId" },
              "to": { "$ref": "#/$defs/packageId" },
              "confidence": { "const": "declared" }
            }
          }
        }
      ]
    }
  }
}
